PMID,Title,Authors,Citation,First Author,Journal/Book,Publication Year,Create Date,PMCID,NIHMS ID,DOI
"28584888","Autism spectrum disorder: neuropathology and animal models","Varghese M, Keshav N, Jacot-Descombes S, Warda T, Wicinski B, Dickstein DL, Harony-Nicolas H, De Rubeis S, Drapeau E, Buxbaum JD, Hof PR.","Acta Neuropathol. 2017 Oct;134(4):537-566. doi: 10.1007/s00401-017-1736-4. Epub 2017 Jun 5.","Varghese M","Acta Neuropathol","2017","2017/06/07","PMC5693718","NIHMS882322","10.1007/s00401-017-1736-4"
"30873608","Phenotypic spectrum of NRXN1 mono- and bi-allelic deficiency: A systematic review","Castronovo P, Baccarin M, Ricciardello A, Picinelli C, Tomaiuolo P, Cucinotta F, Frittoli M, Lintas C, Sacco R, Persico AM.","Clin Genet. 2020 Jan;97(1):125-137. doi: 10.1111/cge.13537. Epub 2019 May 7.","Castronovo P","Clin Genet","2020","2019/03/16","","","10.1111/cge.13537"
"18252227","Structural variation of chromosomes in autism spectrum disorder","Marshall CR, Noor A, Vincent JB, Lionel AC, Feuk L, Skaug J, Shago M, Moessner R, Pinto D, Ren Y, Thiruvahindrapduram B, Fiebig A, Schreiber S, Friedman J, Ketelaars CE, Vos YJ, Ficicioglu C, Kirkpatrick S, Nicolson R, Sloman L, Summers A, Gibbons CA, Teebi A, Chitayat D, Weksberg R, Thompson A, Vardy C, Crosbie V, Luscombe S, Baatjes R, Zwaigenbaum L, Roberts W, Fernandez B, Szatmari P, Scherer SW.","Am J Hum Genet. 2008 Feb;82(2):477-88. doi: 10.1016/j.ajhg.2007.12.009. Epub 2008 Jan 17.","Marshall CR","Am J Hum Genet","2008","2008/02/07","PMC2426913","","10.1016/j.ajhg.2007.12.009"
"30031152","NRXN1 deletion syndrome; phenotypic and penetrance data from 34 families","Al Shehhi M, Forman EB, Fitzgerald JE, McInerney V, Krawczyk J, Shen S, Betts DR, Ardle LM, Gorman KM, King MD, Green A, Gallagher L, Lynch SA.","Eur J Med Genet. 2019 Mar;62(3):204-209. doi: 10.1016/j.ejmg.2018.07.015. Epub 2018 Jul 18.","Al Shehhi M","Eur J Med Genet","2019","2018/07/22","","","10.1016/j.ejmg.2018.07.015"
"32738165","The neurodevelopmental spectrum of synaptic vesicle cycling disorders","John A, Ng-Cordell E, Hanna N, Brkic D, Baker K.","J Neurochem. 2021 Apr;157(2):208-228. doi: 10.1111/jnc.15135. Epub 2020 Aug 18.","John A","J Neurochem","2021","2020/08/02","","","10.1111/jnc.15135"
"28761347","Genetic and epigenetic mechanisms of epilepsy: a review","Chen T, Giri M, Xia Z, Subedi YN, Li Y.","Neuropsychiatr Dis Treat. 2017 Jul 13;13:1841-1859. doi: 10.2147/NDT.S142032. eCollection 2017.","Chen T","Neuropsychiatr Dis Treat","2017","2017/08/02","PMC5516882","","10.2147/NDT.S142032"
"31784728","Neuronal impact of patient-specific aberrant NRXN1α splicing","Flaherty E, Zhu S, Barretto N, Cheng E, Deans PJM, Fernando MB, Schrode N, Francoeur N, Antoine A, Alganem K, Halpern M, Deikus G, Shah H, Fitzgerald M, Ladran I, Gochman P, Rapoport J, Tsankova NM, McCullumsmith R, Hoffman GE, Sebra R, Fang G, Brennand KJ.","Nat Genet. 2019 Dec;51(12):1679-1690. doi: 10.1038/s41588-019-0539-z. Epub 2019 Nov 29.","Flaherty E","Nat Genet","2019","2019/12/01","PMC7451045","NIHMS1541546","10.1038/s41588-019-0539-z"
"32942984","Functional characterization of rare NRXN1 variants identified in autism spectrum disorders and schizophrenia","Ishizuka K, Yoshida T, Kawabata T, Imai A, Mori H, Kimura H, Inada T, Okahisa Y, Egawa J, Usami M, Kushima I, Morikawa M, Okada T, Ikeda M, Branko A, Mori D, Someya T, Iwata N, Ozaki N.","J Neurodev Disord. 2020 Sep 17;12(1):25. doi: 10.1186/s11689-020-09325-2.","Ishizuka K","J Neurodev Disord","2020","2020/09/18","PMC7496212","","10.1186/s11689-020-09325-2"
"31602316","A large data resource of genomic copy number variation across neurodevelopmental disorders","Zarrei M, Burton CL, Engchuan W, Young EJ, Higginbotham EJ, MacDonald JR, Trost B, Chan AJS, Walker S, Lamoureux S, Heung T, Mojarad BA, Kellam B, Paton T, Faheem M, Miron K, Lu C, Wang T, Samler K, Wang X, Costain G, Hoang N, Pellecchia G, Wei J, Patel RV, Thiruvahindrapuram B, Roifman M, Merico D, Goodale T, Drmic I, Speevak M, Howe JL, Yuen RKC, Buchanan JA, Vorstman JAS, Marshall CR, Wintle RF, Rosenberg DR, Hanna GL, Woodbury-Smith M, Cytrynbaum C, Zwaigenbaum L, Elsabbagh M, Flanagan J, Fernandez BA, Carter MT, Szatmari P, Roberts W, Lerch J, Liu X, Nicolson R, Georgiades S, Weksberg R, Arnold PD, Bassett AS, Crosbie J, Schachar R, Stavropoulos DJ, Anagnostou E, Scherer SW.","NPJ Genom Med. 2019 Oct 7;4:26. doi: 10.1038/s41525-019-0098-3. eCollection 2019.","Zarrei M","NPJ Genom Med","2019","2019/10/12","PMC6779875","","10.1038/s41525-019-0098-3"
"27869829","Contribution of copy number variants to schizophrenia from a genome-wide study of 41,321 subjects","Marshall CR, Howrigan DP, Merico D, Thiruvahindrapuram B, Wu W, Greer DS, Antaki D, Shetty A, Holmans PA, Pinto D, Gujral M, Brandler WM, Malhotra D, Wang Z, Fajarado KVF, Maile MS, Ripke S, Agartz I, Albus M, Alexander M, Amin F, Atkins J, Bacanu SA, Belliveau RA Jr, Bergen SE, Bertalan M, Bevilacqua E, Bigdeli TB, Black DW, Bruggeman R, Buccola NG, Buckner RL, Bulik-Sullivan B, Byerley W, Cahn W, Cai G, Cairns MJ, Campion D, Cantor RM, Carr VJ, Carrera N, Catts SV, Chambert KD, Cheng W, Cloninger CR, Cohen D, Cormican P, Craddock N, Crespo-Facorro B, Crowley JJ, Curtis D, Davidson M, Davis KL, Degenhardt F, Del Favero J, DeLisi LE, Dikeos D, Dinan T, Djurovic S, Donohoe G, Drapeau E, Duan J, Dudbridge F, Eichhammer P, Eriksson J, Escott-Price V, Essioux L, Fanous AH, Farh KH, Farrell MS, Frank J, Franke L, Freedman R, Freimer NB, Friedman JI, Forstner AJ, Fromer M, Genovese G, Georgieva L, Gershon ES, Giegling I, Giusti-Rodríguez P, Godard S, Goldstein JI, Gratten J, de Haan L, Hamshere ML, Hansen M, Hansen T, Haroutunian V, Hartmann AM, Henskens FA, Herms S, Hirschhorn JN, Hoffmann P, Hofman A, Huang H, Ikeda M, Joa I, Kähler AK, et al.","Nat Genet. 2017 Jan;49(1):27-35. doi: 10.1038/ng.3725. Epub 2016 Nov 21.","Marshall CR","Nat Genet","2017","2016/11/22","PMC5737772","NIHMS918949","10.1038/ng.3725"
"30100184","Heparan Sulfate Organizes Neuronal Synapses through Neurexin Partnerships","Zhang P, Lu H, Peixoto RT, Pines MK, Ge Y, Oku S, Siddiqui TJ, Xie Y, Wu W, Archer-Hartmann S, Yoshida K, Tanaka KF, Aricescu AR, Azadi P, Gordon MD, Sabatini BL, Wong ROL, Craig AM.","Cell. 2018 Sep 6;174(6):1450-1464.e23. doi: 10.1016/j.cell.2018.07.002. Epub 2018 Aug 9.","Zhang P","Cell","2018","2018/08/14","PMC6173057","","10.1016/j.cell.2018.07.002"
"23375656","Refinement and discovery of new hotspots of copy-number variation associated with autism spectrum disorder","Girirajan S, Dennis MY, Baker C, Malig M, Coe BP, Campbell CD, Mark K, Vu TH, Alkan C, Cheng Z, Biesecker LG, Bernier R, Eichler EE.","Am J Hum Genet. 2013 Feb 7;92(2):221-37. doi: 10.1016/j.ajhg.2012.12.016. Epub 2013 Jan 31.","Girirajan S","Am J Hum Genet","2013","2013/02/05","PMC3567267","","10.1016/j.ajhg.2012.12.016"
"24083347","Neurexins","Reissner C, Runkel F, Missler M.","Genome Biol. 2013;14(9):213. doi: 10.1186/gb-2013-14-9-213.","Reissner C","Genome Biol","2013","2013/10/03","PMC4056431","","10.1186/gb-2013-14-9-213"
"23849776","Detection of clinically relevant genetic variants in autism spectrum disorder by whole-genome sequencing","Jiang YH, Yuen RK, Jin X, Wang M, Chen N, Wu X, Ju J, Mei J, Shi Y, He M, Wang G, Liang J, Wang Z, Cao D, Carter MT, Chrysler C, Drmic IE, Howe JL, Lau L, Marshall CR, Merico D, Nalpathamkalam T, Thiruvahindrapuram B, Thompson A, Uddin M, Walker S, Luo J, Anagnostou E, Zwaigenbaum L, Ring RH, Wang J, Lajonchere C, Wang J, Shih A, Szatmari P, Yang H, Dawson G, Li Y, Scherer SW.","Am J Hum Genet. 2013 Aug 8;93(2):249-63. doi: 10.1016/j.ajhg.2013.06.012. Epub 2013 Jul 11.","Jiang YH","Am J Hum Genet","2013","2013/07/16","PMC3738824","","10.1016/j.ajhg.2013.06.012"
"24188901","Chromosomal microarray analysis of consecutive individuals with autism spectrum disorders or learning disability presenting for genetic services","Roberts JL, Hovanes K, Dasouki M, Manzardo AM, Butler MG.","Gene. 2014 Feb 1;535(1):70-8. doi: 10.1016/j.gene.2013.10.020. Epub 2013 Nov 2.","Roberts JL","Gene","2014","2013/11/06","PMC4423794","NIHMS684267","10.1016/j.gene.2013.10.020"
"21424692","Truncating mutations in NRXN2 and NRXN1 in autism spectrum disorders and schizophrenia","Gauthier J, Siddiqui TJ, Huashan P, Yokomaku D, Hamdan FF, Champagne N, Lapointe M, Spiegelman D, Noreau A, Lafrenière RG, Fathalli F, Joober R, Krebs MO, DeLisi LE, Mottron L, Fombonne E, Michaud JL, Drapeau P, Carbonetto S, Craig AM, Rouleau GA.","Hum Genet. 2011 Oct;130(4):563-73. doi: 10.1007/s00439-011-0975-z. Epub 2011 Mar 22.","Gauthier J","Hum Genet","2011","2011/03/23","PMC3204930","NIHMS332351","10.1007/s00439-011-0975-z"
"31624239","Attention-deficit hyperactivity disorder shares copy number variant risk with schizophrenia and autism spectrum disorder","Gudmundsson OO, Walters GB, Ingason A, Johansson S, Zayats T, Athanasiu L, Sonderby IE, Gustafsson O, Nawaz MS, Jonsson GF, Jonsson L, Knappskog PM, Ingvarsdottir E, Davidsdottir K, Djurovic S, Knudsen GPS, Askeland RB, Haraldsdottir GS, Baldursson G, Magnusson P, Sigurdsson E, Gudbjartsson DF, Stefansson H, Andreassen OA, Haavik J, Reichborn-Kjennerud T, Stefansson K.","Transl Psychiatry. 2019 Oct 17;9(1):258. doi: 10.1038/s41398-019-0599-y.","Gudmundsson OO","Transl Psychiatry","2019","2019/10/19","PMC6797719","","10.1038/s41398-019-0599-y"
"23275889","A discovery resource of rare copy number variations in individuals with autism spectrum disorder","Prasad A, Merico D, Thiruvahindrapuram B, Wei J, Lionel AC, Sato D, Rickaby J, Lu C, Szatmari P, Roberts W, Fernandez BA, Marshall CR, Hatchwell E, Eis PS, Scherer SW.","G3 (Bethesda). 2012 Dec;2(12):1665-85. doi: 10.1534/g3.112.004689. Epub 2012 Dec 1.","Prasad A","G3 (Bethesda)","2012","2013/01/01","PMC3516488","","10.1534/g3.112.004689"
"33191396","Neurexins in autism and schizophrenia-a review of patient mutations, mouse models and potential future directions","Tromp A, Mowry B, Giacomotto J.","Mol Psychiatry. 2021 Mar;26(3):747-760. doi: 10.1038/s41380-020-00944-8. Epub 2020 Nov 15.","Tromp A","Mol Psychiatry","2021","2020/11/16","","","10.1038/s41380-020-00944-8"
"26771491","Astrocytes Assemble Thalamocortical Synapses by Bridging NRX1α and NL1 via Hevin","Singh SK, Stogsdill JA, Pulimood NS, Dingsdale H, Kim YH, Pilaz LJ, Kim IH, Manhaes AC, Rodrigues WS Jr, Pamukcu A, Enustun E, Ertuz Z, Scheiffele P, Soderling SH, Silver DL, Ji RR, Medina AE, Eroglu C.","Cell. 2016 Jan 14;164(1-2):183-196. doi: 10.1016/j.cell.2015.11.034.","Singh SK","Cell","2016","2016/01/16","PMC4715262","NIHMS740070","10.1016/j.cell.2015.11.034"
"31302032","Single cell analysis of autism patient with bi-allelic NRXN1-alpha deletion reveals skewed fate choice in neural progenitors and impaired neuronal functionality","Lam M, Moslem M, Bryois J, Pronk RJ, Uhlin E, Ellström ID, Laan L, Olive J, Morse R, Rönnholm H, Louhivuori L, Korol SV, Dahl N, Uhlén P, Anderlid BM, Kele M, Sullivan PF, Falk A.","Exp Cell Res. 2019 Oct 1;383(1):111469. doi: 10.1016/j.yexcr.2019.06.014. Epub 2019 Jul 12.","Lam M","Exp Cell Res","2019","2019/07/15","","","10.1016/j.yexcr.2019.06.014"
"31138894","Genetic insights and neurobiological implications from NRXN1 in neuropsychiatric disorders","Hu Z, Xiao X, Zhang Z, Li M.","Mol Psychiatry. 2019 Oct;24(10):1400-1414. doi: 10.1038/s41380-019-0438-9. Epub 2019 May 28.","Hu Z","Mol Psychiatry","2019","2019/05/30","","","10.1038/s41380-019-0438-9"
"32472753","Risk factors, diagnosis, prognosis and treatment of autism","Styles M, Alsharshani D, Samara M, Alsharshani M, Khattab A, Qoronfleh MW, Al-Dewik NI.","Front Biosci (Landmark Ed). 2020 Jun 1;25:1682-1717. doi: 10.2741/4873.","Styles M","Front Biosci (Landmark Ed)","2020","2020/05/31","","","10.2741/4873"
"29221905","Neurexins and neuropsychiatric disorders","Kasem E, Kurihara T, Tabuchi K.","Neurosci Res. 2018 Feb;127:53-60. doi: 10.1016/j.neures.2017.10.012. Epub 2017 Dec 6.","Kasem E","Neurosci Res","2018","2017/12/10","","","10.1016/j.neures.2017.10.012"
"26130694","CNVs in neuropsychiatric disorders","Kirov G.","Hum Mol Genet. 2015 Oct 15;24(R1):R45-9. doi: 10.1093/hmg/ddv253. Epub 2015 Jun 30.","Kirov G","Hum Mol Genet","2015","2015/07/02","","","10.1093/hmg/ddv253"
"21658581","Multiple recurrent de novo CNVs, including duplications of the 7q11.23 Williams syndrome region, are strongly associated with autism","Sanders SJ, Ercan-Sencicek AG, Hus V, Luo R, Murtha MT, Moreno-De-Luca D, Chu SH, Moreau MP, Gupta AR, Thomson SA, Mason CE, Bilguvar K, Celestino-Soper PB, Choi M, Crawford EL, Davis L, Wright NR, Dhodapkar RM, DiCola M, DiLullo NM, Fernandez TV, Fielding-Singh V, Fishman DO, Frahm S, Garagaloyan R, Goh GS, Kammela S, Klei L, Lowe JK, Lund SC, McGrew AD, Meyer KA, Moffat WJ, Murdoch JD, O'Roak BJ, Ober GT, Pottenger RS, Raubeson MJ, Song Y, Wang Q, Yaspan BL, Yu TW, Yurkiewicz IR, Beaudet AL, Cantor RM, Curland M, Grice DE, Günel M, Lifton RP, Mane SM, Martin DM, Shaw CA, Sheldon M, Tischfield JA, Walsh CA, Morrow EM, Ledbetter DH, Fombonne E, Lord C, Martin CL, Brooks AI, Sutcliffe JS, Cook EH Jr, Geschwind D, Roeder K, Devlin B, State MW.","Neuron. 2011 Jun 9;70(5):863-85. doi: 10.1016/j.neuron.2011.05.002.","Sanders SJ","Neuron","2011","2011/06/11","PMC3939065","NIHMS459807","10.1016/j.neuron.2011.05.002"
"19545994","A synaptic trek to autism","Bourgeron T.","Curr Opin Neurobiol. 2009 Apr;19(2):231-4. doi: 10.1016/j.conb.2009.06.003. Epub 2009 Jun 21.","Bourgeron T","Curr Opin Neurobiol","2009","2009/06/24","","","10.1016/j.conb.2009.06.003"
"26595880","Heterozygous deletion of α-neurexin I or α-neurexin II results in behaviors relevant to autism and schizophrenia","Dachtler J, Ivorra JL, Rowland TE, Lever C, Rodgers RJ, Clapcote SJ.","Behav Neurosci. 2015 Dec;129(6):765-76. doi: 10.1037/bne0000108.","Dachtler J","Behav Neurosci","2015","2015/11/24","PMC4655861","","10.1037/bne0000108"
"33374371","The Gut-Brain Axis in Autism Spectrum Disorder: A Focus on the Metalloproteases ADAM10 and ADAM17","Zheng Y, Verhoeff TA, Perez Pardo P, Garssen J, Kraneveld AD.","Int J Mol Sci. 2020 Dec 24;22(1):118. doi: 10.3390/ijms22010118.","Zheng Y","Int J Mol Sci","2020","2020/12/30","PMC7796333","","10.3390/ijms22010118"
"21262241","The role of neurexins in schizophrenia and autistic spectrum disorder","Reichelt AC, Rodgers RJ, Clapcote SJ.","Neuropharmacology. 2012 Mar;62(3):1519-26. doi: 10.1016/j.neuropharm.2011.01.024. Epub 2011 Jan 22.","Reichelt AC","Neuropharmacology","2012","2011/01/26","","","10.1016/j.neuropharm.2011.01.024"
"23533028","Molecular and clinical characterization of 25 individuals with exonic deletions of NRXN1 and comprehensive review of the literature","Béna F, Bruno DL, Eriksson M, van Ravenswaaij-Arts C, Stark Z, Dijkhuizen T, Gerkes E, Gimelli S, Ganesamoorthy D, Thuresson AC, Labalme A, Till M, Bilan F, Pasquier L, Kitzis A, Dubourgm C, Rossi M, Bottani A, Gagnebin M, Sanlaville D, Gilbert-Dussardier B, Guipponi M, van Haeringen A, Kriek M, Ruivenkamp C, Antonarakis SE, Anderlid BM, Slater HR, Schoumans J.","Am J Med Genet B Neuropsychiatr Genet. 2013 Jun;162B(4):388-403. doi: 10.1002/ajmg.b.32148. Epub 2013 Mar 26.","Béna F","Am J Med Genet B Neuropsychiatr Genet","2013","2013/03/28","","","10.1002/ajmg.b.32148"
"18419324","The possible interplay of synaptic and clock genes in autism spectrum disorders","Bourgeron T.","Cold Spring Harb Symp Quant Biol. 2007;72:645-54. doi: 10.1101/sqb.2007.72.020.","Bourgeron T","Cold Spring Harb Symp Quant Biol","2007","2008/04/19","","","10.1101/sqb.2007.72.020"
"22228009","Detection and characterization of copy number variation in autism spectrum disorder","Marshall CR, Scherer SW.","Methods Mol Biol. 2012;838:115-35. doi: 10.1007/978-1-61779-507-7_5.","Marshall CR","Methods Mol Biol","2012","2012/01/10","","","10.1007/978-1-61779-507-7_5"
"23495017","Investigation of NRXN1 deletions: clinical and molecular characterization","Dabell MP, Rosenfeld JA, Bader P, Escobar LF, El-Khechen D, Vallee SE, Dinulos MB, Curry C, Fisher J, Tervo R, Hannibal MC, Siefkas K, Wyatt PR, Hughes L, Smith R, Ellingwood S, Lacassie Y, Stroud T, Farrell SA, Sanchez-Lara PA, Randolph LM, Niyazov D, Stevens CA, Schoonveld C, Skidmore D, MacKay S, Miles JH, Moodley M, Huillet A, Neill NJ, Ellison JW, Ballif BC, Shaffer LG.","Am J Med Genet A. 2013 Apr;161A(4):717-31. doi: 10.1002/ajmg.a.35780. Epub 2013 Mar 12.","Dabell MP","Am J Med Genet A","2013","2013/03/16","","","10.1002/ajmg.a.35780"
"31743624","Integrated Transcriptome Analyses Revealed Key Target Genes in Mouse Models of Autism","Duan W, Wang K, Duan Y, Chu X, Ma R, Hu P, Xiong B.","Autism Res. 2020 Mar;13(3):352-368. doi: 10.1002/aur.2240. Epub 2019 Nov 19.","Duan W","Autism Res","2020","2019/11/20","","","10.1002/aur.2240"
"31932357","The clinical relevance of intragenic NRXN1 deletions","Cosemans N, Vandenhove L, Vogels A, Devriendt K, Van Esch H, Van Buggenhout G, Olivié H, de Ravel T, Ortibus E, Legius E, Aerssens P, Breckpot J, R Vermeesch J, Shen S, Fitzgerald J, Gallagher L, Peeters H.","J Med Genet. 2020 May;57(5):347-355. doi: 10.1136/jmedgenet-2019-106448. Epub 2020 Jan 13.","Cosemans N","J Med Genet","2020","2020/01/15","","","10.1136/jmedgenet-2019-106448"
"30675382","Both rare and common genetic variants contribute to autism in the Faroe Islands","Leblond CS, Cliquet F, Carton C, Huguet G, Mathieu A, Kergrohen T, Buratti J, Lemière N, Cuisset L, Bienvenu T, Boland A, Deleuze JF, Stora T, Biskupstoe R, Halling J, Andorsdóttir G, Billstedt E, Gillberg C, Bourgeron T.","NPJ Genom Med. 2019 Jan 21;4:1. doi: 10.1038/s41525-018-0075-2. eCollection 2019.","Leblond CS","NPJ Genom Med","2019","2019/01/25","PMC6341098","","10.1038/s41525-018-0075-2"
"26216298","Neurexin 1 (NRXN1) splice isoform expression during human neocortical development and aging","Jenkins AK, Paterson C, Wang Y, Hyde TM, Kleinman JE, Law AJ.","Mol Psychiatry. 2016 May;21(5):701-6. doi: 10.1038/mp.2015.107. Epub 2015 Jul 28.","Jenkins AK","Mol Psychiatry","2016","2015/07/29","PMC4731316","NIHMS702572","10.1038/mp.2015.107"
"20010541","Osmotic avoidance in Caenorhabditis elegans: synaptic function of two genes, orthologues of human NRXN1 and NLGN1, as candidates for autism","Calahorro F, Alejandre E, Ruiz-Rubio M.","J Vis Exp. 2009 Dec 11;(34):1616. doi: 10.3791/1616.","Calahorro F","J Vis Exp","2009","2009/12/17","PMC3346054","","10.3791/1616"
"22813947","Copy number variations in neurodevelopmental disorders","Grayton HM, Fernandes C, Rujescu D, Collier DA.","Prog Neurobiol. 2012 Oct;99(1):81-91. doi: 10.1016/j.pneurobio.2012.07.005. Epub 2012 Jul 17.","Grayton HM","Prog Neurobiol","2012","2012/07/21","","","10.1016/j.pneurobio.2012.07.005"
"28649445","Variable phenotype expression in a family segregating microdeletions of the NRXN1 and MBD5 autism spectrum disorder susceptibility genes","Woodbury-Smith M, Nicolson R, Zarrei M, Yuen RKC, Walker S, Howe J, Uddin M, Hoang N, Buchanan JA, Chrysler C, Thompson A, Szatmari P, Scherer SW.","NPJ Genom Med. 2017 May 3;2:17. doi: 10.1038/s41525-017-0020-9.","Woodbury-Smith M","NPJ Genom Med","2017","2017/06/27","PMC5482711","CAMS6765","10.1038/s41525-017-0020-9"
"20162629","Intragenic rearrangements in NRXN1 in three families with autism spectrum disorder, developmental delay, and speech delay","Wiśniowiecka-Kowalnik B, Nesteruk M, Peters SU, Xia Z, Cooper ML, Savage S, Amato RS, Bader P, Browning MF, Haun CL, Duda AW 3rd, Cheung SW, Stankiewicz P.","Am J Med Genet B Neuropsychiatr Genet. 2010 Jul;153B(5):983-93. doi: 10.1002/ajmg.b.31064.","Wiśniowiecka-Kowalnik B","Am J Med Genet B Neuropsychiatr Genet","2010","2010/02/18","","","10.1002/ajmg.b.31064"
"21827697","Expanding the clinical spectrum associated with defects in CNTNAP2 and NRXN1","Gregor A, Albrecht B, Bader I, Bijlsma EK, Ekici AB, Engels H, Hackmann K, Horn D, Hoyer J, Klapecki J, Kohlhase J, Maystadt I, Nagl S, Prott E, Tinschert S, Ullmann R, Wohlleber E, Woods G, Reis A, Rauch A, Zweier C.","BMC Med Genet. 2011 Aug 9;12:106. doi: 10.1186/1471-2350-12-106.","Gregor A","BMC Med Genet","2011","2011/08/11","PMC3162517","","10.1186/1471-2350-12-106"
"19896112","CNTNAP2 and NRXN1 are mutated in autosomal-recessive Pitt-Hopkins-like mental retardation and determine the level of a common synaptic protein in Drosophila","Zweier C, de Jong EK, Zweier M, Orrico A, Ousager LB, Collins AL, Bijlsma EK, Oortveld MA, Ekici AB, Reis A, Schenck A, Rauch A.","Am J Hum Genet. 2009 Nov;85(5):655-66. doi: 10.1016/j.ajhg.2009.10.004. Epub 2009 Nov 5.","Zweier C","Am J Hum Genet","2009","2009/11/10","PMC2775834","","10.1016/j.ajhg.2009.10.004"
"21687627","Neurexin-1 and frontal lobe white matter: an overlapping intermediate phenotype for schizophrenia and autism spectrum disorders","Voineskos AN, Lett TA, Lerch JP, Tiwari AK, Ameis SH, Rajji TK, Müller DJ, Mulsant BH, Kennedy JL.","PLoS One. 2011;6(6):e20982. doi: 10.1371/journal.pone.0020982. Epub 2011 Jun 8.","Voineskos AN","PLoS One","2011","2011/06/21","PMC3110800","","10.1371/journal.pone.0020982"
"30358070","Characterization of speech and language phenotype in children with NRXN1 deletions","Brignell A, St John M, Boys A, Bruce A, Dinale C, Pigdon L, Hildebrand MS, Amor DJ, Morgan AT.","Am J Med Genet B Neuropsychiatr Genet. 2018 Dec;177(8):700-708. doi: 10.1002/ajmg.b.32664. Epub 2018 Oct 25.","Brignell A","Am J Med Genet B Neuropsychiatr Genet","2018","2018/10/26","","","10.1002/ajmg.b.32664"
"21895634","Recent genomic advances in schizophrenia","Doherty JL, O'Donovan MC, Owen MJ.","Clin Genet. 2012 Feb;81(2):103-9. doi: 10.1111/j.1399-0004.2011.01773.x. Epub 2011 Oct 5.","Doherty JL","Clin Genet","2012","2011/09/08","","","10.1111/j.1399-0004.2011.01773.x"
"34487988","Rare NRXN1 missense variants identified in autism interfered protein degradation and Drosophila sleeping","Liu Y, Shen L, Zhang Y, Zhao R, Liu C, Luo S, Chen J, Xia L, Li T, Peng Y, Xia K.","J Psychiatr Res. 2021 Nov;143:113-122. doi: 10.1016/j.jpsychires.2021.09.013. Epub 2021 Sep 2.","Liu Y","J Psychiatr Res","2021","2021/09/06","","","10.1016/j.jpsychires.2021.09.013"
"22374773","[Differential diagnosis between the autistic spectrum and the schizophrenic spectrum]","Paula-Pérez I.","Rev Neurol. 2012 Feb 29;54 Suppl 1:S51-62.","Paula-Pérez I","Rev Neurol","2012","2012/03/01","","",""
"19348707","Genetics of autism spectrum disorders","Kumar RA, Christian SL.","Curr Neurol Neurosci Rep. 2009 May;9(3):188-97. doi: 10.1007/s11910-009-0029-2.","Kumar RA","Curr Neurol Neurosci Rep","2009","2009/04/08","","","10.1007/s11910-009-0029-2"
"22832527","Genetic regulation of Nrxn1 [corrected] expression: an integrative cross-species analysis of schizophrenia candidate genes","Mozhui K, Wang X, Chen J, Mulligan MK, Li Z, Ingles J, Chen X, Lu L, Williams RW.","Transl Psychiatry. 2011 Jul 26;1(7):e25. doi: 10.1038/tp.2011.24.","Mozhui K","Transl Psychiatry","2011","2012/07/27","PMC3309521","","10.1038/tp.2011.24"
"31812984","Ketamine Restores Thalamic-Prefrontal Cortex Functional Connectivity in a Mouse Model of Neurodevelopmental Disorder-Associated 2p16.3 Deletion","B Hughes R, Whittingham-Dowd J, Simmons RE, Clapcote SJ, Broughton SJ, Dawson N.","Cereb Cortex. 2020 Apr 14;30(4):2358-2371. doi: 10.1093/cercor/bhz244.","B Hughes R","Cereb Cortex","2020","2019/12/09","PMC7175007","","10.1093/cercor/bhz244"
"32298718","Convergent brain microstructure across multiple genetic models of schizophrenia and autism spectrum disorder: A feasibility study","Barnett BR, Casey CP, Torres-Velázquez M, Rowley PA, Yu JJ.","Magn Reson Imaging. 2020 Jul;70:36-42. doi: 10.1016/j.mri.2020.04.002. Epub 2020 Apr 13.","Barnett BR","Magn Reson Imaging","2020","2020/04/17","PMC7685399","NIHMS1587945","10.1016/j.mri.2020.04.002"
"30557783","Convergent microstructural brain changes across genetic models of autism spectrum disorder-A pilot study","Rowley PA, Guerrero-Gonzalez J, Alexander AL, Yu JJ.","Psychiatry Res Neuroimaging. 2019 Jan 30;283:83-91. doi: 10.1016/j.pscychresns.2018.12.007. Epub 2018 Dec 8.","Rowley PA","Psychiatry Res Neuroimaging","2019","2018/12/18","PMC6398946","NIHMS1516802","10.1016/j.pscychresns.2018.12.007"
"28289584","Mutation analysis of the NRXN1 gene in autism spectrum disorders","Onay H, Kacamak D, Kavasoglu AN, Akgun B, Yalcinli M, Kose S, Ozbaran B.","Balkan J Med Genet. 2017 Mar 8;19(2):17-22. doi: 10.1515/bjmg-2016-0031. eCollection 2016 Dec 1.","Onay H","Balkan J Med Genet","2017","2017/03/15","PMC5343326","","10.1515/bjmg-2016-0031"
"22037798","Neurexins and neuroligins: recent insights from invertebrates","Knight D, Xie W, Boulianne GL.","Mol Neurobiol. 2011 Dec;44(3):426-40. doi: 10.1007/s12035-011-8213-1. Epub 2011 Oct 30.","Knight D","Mol Neurobiol","2011","2011/11/01","PMC3229692","","10.1007/s12035-011-8213-1"
"19818200","What have the genomics ever done for the psychoses?","Gill M, Donohoe G, Corvin A.","Psychol Med. 2010 Apr;40(4):529-40. doi: 10.1017/S0033291709991139. Epub 2009 Oct 12.","Gill M","Psychol Med","2010","2009/10/13","","","10.1017/S0033291709991139"
"27897003","DE NOVO MUTATIONS IN AUTISM IMPLICATE THE SYNAPTIC ELIMINATION NETWORK","Venkataraman GR, O'Connell C, Egawa F, Kashef-Haghighi D, Wall DP.","Pac Symp Biocomput. 2017;22:521-532. doi: 10.1142/9789813207813_0048.","Venkataraman GR","Pac Symp Biocomput","2017","2016/11/30","","","10.1142/9789813207813_0048"
"31872500","Molecular causes of sex-specific deficits in rodent models of neurodevelopmental disorders","Mossa A, Manzini MC.","J Neurosci Res. 2021 Jan;99(1):37-56. doi: 10.1002/jnr.24577. Epub 2019 Dec 23.","Mossa A","J Neurosci Res","2021","2019/12/25","PMC7754327","","10.1002/jnr.24577"
